{
  "$schema": "./new-api-route-parity.schema.json",
  "version": 1,
  "objective": "Reach 100% public route compatibility with QuantumNous/new-api without adding Redis.",
  "sourceSnapshot": {
    "project": "QuantumNous/new-api",
    "commit": "6c35e1ef2671be8bd3c230882e4ff5a885e89c57",
    "checkedAt": "2026-06-27",
    "evidence": [
      "router/relay-router.go",
      "router/video-router.go",
      "router/api-router.go",
      "router/dashboard.go"
    ]
  },
  "completionPolicy": {
    "routeCoverage": "all-public-routes-required",
    "redisPolicy": "forbidden-runtime-dependency",
    "strictCommand": "bun run check:new-api-route-parity-strict"
  },
  "routeGroups": [
    {
      "id": "relay-openai-core",
      "status": "implemented",
      "source": "router/relay-router.go",
      "routes": [
        "GET /v1/models",
        "GET /v1/models/:model",
        "GET /v1beta/openai/models",
        "POST /pg/chat/completions",
        "GET /v1/realtime",
        "POST /v1/messages",
        "POST /v1/completions",
        "POST /v1/chat/completions",
        "POST /v1/responses",
        "POST /v1/responses/compact",
        "POST /v1/edits",
        "POST /v1/images/generations",
        "POST /v1/images/edits",
        "POST /v1/images/variations",
        "POST /v1/embeddings",
        "POST /v1/audio/transcriptions",
        "POST /v1/audio/translations",
        "POST /v1/audio/speech",
        "POST /v1/rerank",
        "POST /v1/engines/:model/embeddings",
        "POST /v1/models/*path",
        "POST /v1/moderations",
        "GET /v1/files",
        "POST /v1/files",
        "DELETE /v1/files/:id",
        "GET /v1/files/:id",
        "GET /v1/files/:id/content",
        "POST /v1/fine-tunes",
        "GET /v1/fine-tunes",
        "GET /v1/fine-tunes/:id",
        "POST /v1/fine-tunes/:id/cancel",
        "GET /v1/fine-tunes/:id/events",
        "DELETE /v1/models/:model"
      ],
      "elygateEvidence": [
        "apps/gateway/src/index.ts",
        "apps/gateway/src/routes/models.ts",
        "apps/gateway/src/routes/chat.ts",
        "apps/gateway/src/routes/responses.ts",
        "apps/gateway/src/routes/files.ts",
        "apps/gateway/src/routes/fine-tune.ts"
      ],
      "blockers": []
    },
    {
      "id": "relay-gemini-media-task",
      "status": "implemented",
      "source": "router/relay-router.go, router/video-router.go",
      "routes": [
        "GET /v1beta/models",
        "POST /v1beta/models/*path",
        "GET /mj/image/:id",
        "POST /mj/submit/action",
        "POST /mj/submit/shorten",
        "POST /mj/submit/modal",
        "POST /mj/submit/imagine",
        "POST /mj/submit/change",
        "POST /mj/submit/simple-change",
        "POST /mj/submit/describe",
        "POST /mj/submit/blend",
        "POST /mj/submit/edits",
        "POST /mj/submit/video",
        "GET /mj/task/:id/fetch",
        "GET /mj/task/:id/image-seed",
        "POST /mj/task/list-by-condition",
        "POST /mj/insight-face/swap",
        "POST /mj/submit/upload-discord-images",
        "GET /:mode/mj/image/:id",
        "POST /:mode/mj/submit/*",
        "GET /:mode/mj/task/:id/fetch",
        "GET /:mode/mj/task/:id/image-seed",
        "POST /:mode/mj/task/list-by-condition",
        "POST /:mode/mj/insight-face/swap",
        "POST /suno/submit/:action",
        "POST /suno/fetch",
        "GET /suno/fetch/:id",
        "POST /v1/video/generations",
        "GET /v1/video/generations/:task_id",
        "POST /v1/videos",
        "GET /v1/videos/:task_id",
        "GET /v1/videos/:task_id/content",
        "POST /v1/videos/:video_id/remix",
        "POST /kling/v1/videos/text2video",
        "POST /kling/v1/videos/image2video",
        "GET /kling/v1/videos/text2video/:task_id",
        "GET /kling/v1/videos/image2video/:task_id",
        "POST /jimeng"
      ],
      "elygateEvidence": [
        "apps/gateway/src/routes/gemini.ts",
        "apps/gateway/src/routes/mj.ts",
        "apps/gateway/src/routes/video.ts",
        "apps/gateway/src/routes/newApiRelayCompat.ts",
        "apps/gateway/src/routes/newApiRelayCompat.test.ts"
      ],
      "blockers": []
    },
    {
      "id": "dashboard-billing",
      "status": "implemented",
      "source": "router/dashboard.go",
      "routes": [
        "GET /dashboard/billing/subscription",
        "GET /v1/dashboard/billing/subscription",
        "GET /dashboard/billing/usage",
        "GET /v1/dashboard/billing/usage"
      ],
      "elygateEvidence": [
        "apps/gateway/src/routes/dashboard-billing.ts",
        "apps/gateway/src/index.ts"
      ],
      "blockers": []
    },
    {
      "id": "dashboard-public-api",
      "status": "implemented",
      "source": "router/api-router.go",
      "routes": [
        "GET /api/setup",
        "POST /api/setup",
        "GET /api/status",
        "GET /api/uptime/status",
        "GET /api/status/test",
        "GET /api/notice",
        "GET /api/user-agreement",
        "GET /api/privacy-policy",
        "GET /api/about",
        "GET /api/home_page_content",
        "GET /api/pricing",
        "GET /api/verification",
        "GET /api/reset_password",
        "POST /api/user/reset",
        "GET /api/oauth/state",
        "POST /api/oauth/email/bind",
        "GET /api/oauth/wechat",
        "POST /api/oauth/wechat/bind",
        "GET /api/oauth/telegram/login",
        "GET /api/oauth/telegram/bind",
        "GET /api/oauth/:provider",
        "GET /api/ratio_config",
        "POST /api/stripe/webhook",
        "POST /api/creem/webhook",
        "POST /api/waffo/webhook",
        "POST /api/waffo-pancake/webhook/:env",
        "POST /api/verify"
      ],
      "elygateEvidence": [
        "apps/gateway/src/routes/sys.ts",
        "apps/gateway/src/routes/payment.ts",
        "apps/gateway/src/index.ts"
      ],
      "blockers": []
    },
    {
      "id": "dashboard-admin-self-api",
      "status": "implemented",
      "source": "router/api-router.go",
      "routes": [
        "GET /api/models",
        "GET /api/perf-metrics/summary",
        "GET /api/perf-metrics",
        "GET /api/rankings",
        "GET|POST|PUT|DELETE /api/user/*",
        "GET|POST|PUT|PATCH|DELETE /api/subscription/*",
        "GET|PUT|POST|DELETE /api/option/*",
        "GET|POST|PUT|DELETE /api/custom-oauth-provider/*",
        "GET|POST|DELETE /api/performance/*",
        "GET|POST /api/ratio_sync/*",
        "GET|POST|PUT|DELETE /api/channel/*",
        "GET|POST|PUT|DELETE /api/token/*",
        "GET /api/usage/token",
        "GET|POST|PUT|DELETE /api/redemption/*",
        "GET|DELETE /api/log/*",
        "GET|POST /api/system-task/*",
        "GET /api/system-info/instances",
        "GET /api/data/*",
        "GET /api/group/*",
        "GET|POST|PUT|DELETE /api/prefill_group/*",
        "GET /api/mj/*",
        "GET /api/task/*",
        "GET|POST|PUT|DELETE /api/vendors/*",
        "GET|POST|PUT|DELETE /api/models/*",
        "GET|POST|PUT|DELETE /api/deployments/*"
      ],
      "elygateEvidence": [
        "apps/gateway/src/index.ts",
        "apps/gateway/src/routes/sys.ts",
        "apps/gateway/src/routes/admin/newApiCompat.ts",
        "apps/gateway/src/routes/admin/newApiUserCompat.ts",
        "apps/gateway/src/routes/stats.ts",
        "scripts/check-new-api-dashboard-route-smoke.ts"
      ],
      "blockers": []
    }
  ]
}
